facebook_corpus_msr_337199,"Upper wala Yaa Mathi "" pathar kuu Mathh Puchoo Bolraa . Khulay Lafzou mai . Uss khudaa ki Shaan hee kuch Alag hai.",NAG
facebook_corpus_msr_452739,Pehle ladka roya ab ladki . Itta dukh kyu he bika ka inko,NAG
facebook_corpus_msr_442474,"hdfc bank mai gundaa gardi ye log employee se mis behav krke apna business karwaate hai tabhi aaj hdfc bank sabse top pr hai Delhi ITO Express Building mai hui 4 emploees k sath gundaaagardi aur unse liyaa gyaa force krke resign sankalp shukla (Sankalp.shukla@hdfcbank.com) khushboo nebhnani (Khushboo.nebhnani@hdfcbank.com) ye dono nai liyaa resign khushboo off k din office open karwaakar attandence register pr fluid lagaati hai taaki kisi ko pataa na lagay agar HR ko complaint karte hai smily mehra and kasmira patel (smily.mehra@hdfcbank.com, kashmira.patil@hdfcbank.com) jo HBL KI hr hai unko mail karte hai to kuch clarification yaa puchnaa jarurui nai samajte ki employee ki galti hai ya nai bus jo hamare mentor nai employee ke against mail krdi wo ok hai totally gundaagardi hai hffc bank mai",CAG
facebook_corpus_msr_1305225,рдиреЛрдХрд░реА рдХрд░рддреЗ рд╣реИ рдУрд░..... (part time job рдХрд░рдХреЗ) рдкреИрд╕рд╛ рдХрдорд╛рдирд╛ рдЪрд╛рд╣рддреЗ рд╣реИ рддреЛ .......рдЖрдЗрдпреЗ DIGITAL INDIA рд╕реЗ рдЬреБрдбрд╝рд┐рдпреЗ.....рдФрд░ рдШрд░ рдмреИрдареЗ рд▓рд╛рдЦреЛ рдХрдорд╛рдпреЗ.......рдФрд░ рджреВрд╕рд░реЗ рдХреЛ рднреА рдХрдорд╛рдиреЗ рдХрд╛ рдореМрдХрд╛ рджреАрдЬрд┐рдП...рдХреЛрдИ рдЗрдирд╡реЗрд╕реНрдЯрдореЗрдиреНрдЯ рдирд╣реАрдВ рд╣реИ......рдЖрдИрдпреЗ рдмреЗрд░реЛрдЬрдЧрд╛рд░реА рдХреЛ рднрд╛рд░рдд рд╕реЗ рдЙрдЦрд╛рдбрд╝ рдлреЗрдХрдиреЗ рдореЗ рд╣рдорд╛рд░реА рдорджрдж рдХреАрдЬрд┐рдпреЗ.......JOIN рд╣реЛрдиреЗ рдХреЗ рд▓рд┐рдП рдЖрдк 1тГг рд╕рдмрд╕реЗ рдкрд╣рд▓реЗ рдЕрдкрдиреЗ рдлрд╝реЛрди рдХреЗ play store рдореЗрдВ рдЬрд╛рдУ | 2тГг рд╡рд╣рд╛рдБ рдкрд░ Champcash рд▓рд┐рдЦреЛ рдФрд░ рдЙрд╕ apps рдХреЛ рдЕрдкрдиреЗ рдореЛрдмрд╛рдЗрд▓ рдореЗрдВ install рдХрд░ рд▓реЛ ! 3тГг рдЕрдм apps рдкрд░ click рдХрд░реЛ рдФрд░ sign up with champ cash рдкрд░click рдХрд░рдХреЗ рдЕрдкрдиреА рдбрд┐рдЯреЗрд▓реНрд╕ рднрд░ рджреЛ. 4тГг рдЕрдм рдЖрдкрд╕реЗ sponsor id рдкреВрдЫреЗрдЧрд╛ рд╡рд╣рд╛рдБ рдкрд░ 1238042 рдбрд╛рд▓ рджреЛ рдФрд░ рдЕрдкрдиреА id рдмрдирд╛ рд▓реЛ ! Ab apke samne ek chalange ayega dosto isko acspt & complet karna jaruri h. ***Install karte hi 1$=66rs milega Jis se aap shopping/Recharge/ bank se redeem kar sakte ho,NAG
facebook_corpus_msr_2241594,рджреБрд░реНрдпреЛрдзрди рдФрд░ рд░рд╛рд╣реБрд▓ рдЧрд╛рдВрдзреА - рджреЛрдиреЛрдВ рд╣реА рдЕрдпреЛрдЧреНрдп рд╣реЛрдиреЗ рдкрд░ рднреА рд╕рд┐рд░реНрдл рд░рд╛рдЬрдкрд░рд┐рд╡рд╛рд░ рдореЗрдВ рдкреИрджрд╛ рд╣реЛрдиреЗ рдХреЗ рдХрд╛рд░рди рд╢рд╛рд╕рди рдкрд░ рдЕрдкрдирд╛ рдЕрдзрд┐рдХрд╛рд░ рд╕рдордЭрддреЗ рд╣реИрдВред рднреАрд╖реНрдо рдФрд░ рдЖрдбрд╡рд╛рдгреА - рдХрднреА рднреА рд╕рддреНрддрд╛рд░реВреЭ рдирд╣реА рд╣реЛ рд╕рдХреЗ рдлрд┐рд░ рднреА рд╕рдмрд╕реЗ рдЬреНрдпрд╛рджрд╛ рд╕рдореНрдорд╛рди рдорд┐рд▓рд╛ред рдЙрд╕рдХреЗ рдмрд╛рдж рднреА рдЬреАрд╡рди рдХреЗ рдЕрдВрддрд┐рдо рдкреЬрд╛рд╡ рдкреЗ рд╕рдмрд╕реЗ рдЬреНрдпрд╛рджрд╛ рдЕрд╕рд╣рд╛рдп рджрд┐рдЦрддреЗ рд╣реИрдВред рдЕрд░реНрдЬреБрди рдФрд░ рдирд░реЗрдВрджреНрд░ рдореЛрджреА- рджреЛрдиреЛрдВ рдпреЛрдЧреНрдпрддрд╛ рд╕реЗ рдзрд░реНрдордВ рдХреЗ рдорд╛рд░реНрдЧ рдкрд░ рдЪрд▓рддреЗ рд╣реБрдП рд╢реАрд░реНрд╖ рдкрд░ рдкрд╣реБрдЪреЗ рдЬрд╣рд╛рдБ рдЙрдирдХреЛ рдПрд╣рд╕рд╛рд╕ рд╣реБрдЖ рдХреА рдзрд░реНрдо рдХрд╛ рдкрд╛рд▓рди рдХрд░ рдкрд╛рдирд╛ рдХрд┐рддрдирд╛ рдХрдард┐рди рд╣реЛрддрд╛ рд╣реИред рдХрд░реНрдг рдФрд░ рдордирдореЛрд╣рди рд╕рд┐рдВрд╣ - рдмреБрджреНрдзрд┐рдорд╛рди рдФрд░ рдпреЛрдЧреНрдп рд╣реЛрддреЗ рд╣реБрдП рднреА рдЕрдзрд░реНрдо рдХрд╛ рдкрдХреНрд╖ рд▓реЗрдиреЗ рдХреЗ рдХрд╛рд░рдг рдЬреАрд╡рди рдореЗрдВ рд╡рд╛рдВрдЫрд┐рдд рд╕рдлрд▓рддрд╛ рди рдкрд╛ рд╕рдХреЗред рдЬрдпрджреНрд░рде рдФрд░ рдХреЗрдЬрд░реАрд╡рд╛рд▓- рджреЛрдиреЛрдВ рдЕрддрд┐ рдорд╣рддреНрд╡рд╛рдХрд╛рдВрдХреНрд╖реА рдПрдХ рдиреЗ рдЕрд░реНрдЬреБрди рдХрд╛ рд╡рд┐рд░реЛрдз рдХрд┐рдпрд╛ рджреВрд╕рд░реЗ рдиреЗ рдореЛрджреА рдХрд╛ред рд╣рд╛рд▓рд╛рдВрдХрд┐ рдЗрдирдХреЛ рд░рд╛рдЬреНрдп рддреЛ рдкреНрд░рд╛рдкреНрдд рд╣реБрдЖ рд▓реЗрдХрд┐рди рдШрдЯрд┐рдпрд╛ рд░рд╛рдЬрдиреАрддрд┐рдХ рд╕реЛрдЪ рдХреЗ рдХрд╛рд░рдг рдмрд╛рдж рдореЗрдВ рдЗрдирдХреА рдмреБрд░рд╛рдИ рд╣реА рд╣реБрдпреАред рд╢рдХреБрдирд┐ рдФрд░ рджрд┐рдЧреНрд╡рд┐рдЬрдп- рджреЛрдиреЛрдВ рд╣реА рдЕрдкрдиреЗ рд╕реНрд╡рд╛рд░реНрде рдХреЗ рд▓рд┐рдП рдЕрдпреЛрдЧреНрдп рдорд╛рд▓рд┐рдХреЛ рдХреА рдЬреАрд╡рдирднрд░ рдЪрд╛рдЯреБрдХрд╛рд░рд┐рддрд╛ рдХрд░рддреЗ рд░рд╣реЗред рдзреГрддрд░рд╛рд╖реНрдЯреНрд░ рдФрд░ рд╕реЛрдирд┐рдпрд╛ - рдЕрдкрдиреЗ рдкреБрддреНрд░ рдкреНрд░реЗрдо рдореЗрдВ рдЕрдВрдзреЗ рд╣реИред рд╢реНрд░реАрдХреГрд╖реНрдг рдФрд░ рдХрд▓рд╛рдо- рднрд╛рд░рдд рдореЗрдВ рджреЛрдиреЛрдВ рдХреЛ рдмрд╣реБрдд рд╕рдореНрдорд╛рди рджрд┐рдпрд╛ рдЬрд╛рддрд╛ рд╣реИ рдкрд░рдиреНрддреБ рди рдЙрдирдХреА рд╢рд┐рдХреНрд╖рд╛рдУрдВ рдХреЛ рдХреЛрдИ рдорд╛рдирддрд╛ рд╣реИ рдФрд░ рди рдЙрдирдХреЗ рдмрддрд╛рдпреЗ рд░рд╛рд╕реНрддреЗ рдХрд╛ рдЕрдиреБрд╕рд░рдг рдХрд░рддрд╛ рд╣реИред --рдпрд╣ рд╣реИ рднрд╛рд░рдд рдФрд░ рдорд╣рд╛рднрд╛рд░рдд,NAG
facebook_corpus_msr_367405,"sabhi shahid pulis or bank guard ko manpurvak bhavpurn shradhhanjali..ye modi pheku hai is ke hath se kuch nhi hoga.har roj army,pulis marati rahegi but yen ko kuch bhi phikr nhi,,isaliye bharatiy janta sudhar jao...modi ke andphakt mat bno..",OAG
facebook_corpus_msr_337038,рддреБрдо рд▓реЛрдЧ рд╕рд╛рд▓реЛрдВ рдЕрдкрдиреЛрдВ рдореЗрдВ рд▓рдбрд╝реЛрдЧреЗ рддреЛ рдЬрдирддрд╛ рдХрд╛ рдХреНрдпрд╛ рдХрд╛рдо рдХрд░реЛрдЧреЗ рддреБрдо рд▓реЛрдЧ рд╕рд╛рд▓реЗ рдЖрдкрд╕ рдореЗрдВ рд╣реА рдорд░ рдЬрд╛рддреЗ рд╣реИрдВ рдЬрдирддрд╛ рдХреЗ рдкреАрдЫреЗ рдХрд╛ рднреА рд▓рдбрд╝реЗ рд╣реЛ рдХреЛрдИ рдЬрдирддрд╛ рдХреЗ рд╡рд┐рд╖рдп рдмрд╛рдд рдХреА рд╣реЛ рддреБрдо рд▓реЛрдЧ рд╕рд╛рд▓реЗ рдЖрдкрд╕ рдореЗрдВ рд╣реА рдорд░ рд░рд╣реЗ рд╣реЛ рд╡реИрд╕реЗ рдЖрдо рдЖрджрдореА рдкрд╛рд░реНрдЯреА рд╣рдорд╛рд░реА рдмрдбрд╝реА рдЧрд╛рдВрдб рдореЗрдВ рдШреБрд╕ рдЧрдИ рд╣рдорд╛рд░реА рдкрд╛рд░реНрдЯреА рдЗрддрдирд╛ рдЕрдЪреНрдЫрд╛ рдирд╛рдо рдерд╛ рдЙрддрдирд╛ рдЦрд░рд╛рдм рдХрд╛рдо рд╣реИ рддреБрдо рд▓реЛрдЧ рдХрд╛,OAG
facebook_corpus_msr_1381066,"рдЕрд░реБрдг рдЬреЗрдЯрд▓реА рдХреЗ рдлреЗрд╕рдмреБрдХ рдкреЛрд╕реНрдЯ рдХреЗ рдЬрд╡рд╛рдм рдореЗрдВ рджрд┐рдЧреНрд╡рд┐рдЬрдп рдиреЗ рдЯреНрд╡рд┐рдЯрд░ рдХреЗ рдЬрд░рд┐рдП рд╕рд╛рдзрд╛ рдирд┐рд╢рд╛рдирд╛....
http://khabar.ndtv.com/news/india/digvijay-takes-on-jaitley-on-issues-related-to-gst-bill-1203230
#JaitleyDigvijay",CAG
facebook_corpus_msr_404062,Dunia ka yo pta nai .Tum logo ko ache tarha pta ha..tum logo ko hafiz saeed ka b khob pta ha...Chakrovorty Prosen,CAG
facebook_corpus_msr_300397,"City me media hai 
Choti jagah pr sab bhrast hai",OAG
facebook_corpus_msr_2242047,Paise dede.,NAG
facebook_corpus_msr_1600607,"Modiji, kuch  to kijie ?",CAG
facebook_corpus_msr_367696,Unke 7 mrte h or hmare 14 Ku???????????? Hmare 7 k badle me unke 70 Jane chaiye.....modi Ji videsh yatra or politics se fursat mil jaye toh desh k jawano k liye b kch sonch lena ЁЯШаЁЯШаЁЯШаЁЯШа,OAG
facebook_corpus_msr_402593,India ka bhok ne wala harami sala. Desh ka kalank desh ka dhabba. Goli mardena chahiye in disturbing  factors ko,OAG
facebook_corpus_msr_656287,рд▓рд┐рдВрдХ рд╢реЛ рдирд╣реА рдХрд░ рд░рд╣рд╛ рд╣реИред,NAG
facebook_corpus_msr_1731714,lalua pagla hai,OAG
facebook_corpus_msr_300229,"рдЖрдИрдП Digital India рд╕реЗ рдЬреБрдбрд╝рд┐рдП! рдЕрдкрдиреЗ  Android Phone рд╕реЗ Rs5000-25000/- рдорд╣реАрдирд╛ рдХрдорд╛рдпреЗрдВ рдмрд┐рдирд╛ рдПрдХ рднреА рдкреИрд╕рд╛ рд▓рдЧрд╛рдпреЗ ! рди рд╣реА рдХреБрдЫ рдмреЗрдЪрдирд╛ рд╣реИ рди рд╣реА рдЦрд░реАрджрдирд╛ ! рдЬреЛрдЗрдирд┐рдБрдЧ рдХреЗ рд▓рд┐рдпреЗ рдЖрдк рдЗрд╕ WhatsApp no 7987573941 рдкрд░ ""JOIN"" рд▓рд┐рдЦ рдХрд░ send рдХреАрдЬрд┐рдП",NAG
facebook_corpus_msr_386735,"Tum Khali jute maro bhadkau bayan do yahi kaam Hai 
Waha sarhad pr mang ka sindur ujad raha hai bache yateem ho rahe hain lasho pr lashen gir rahi hain Hamare jawano ki shahadat ho rahi hai or tum Khali jute maro kadi ninda Kro 
Are Khuda Ke liye mulk Ki jamhuriyat ko mat todo 
Neta nahi Ek deshbhakt ban jao 
Insaan ban jao",CAG
facebook_corpus_msr_360982,Konsi pm se ye sab ho saktha wo bhi bathao,CAG
facebook_corpus_msr_1423679,tere cn k time v yahi hal tha up tab to yad nahi aaya,CAG
facebook_corpus_msr_1724014,рдзреАрд░реЗ рдзреАрд░реЗ рдЗрдВрдбрд┐рдпрд╛ рд╕реЗ рд╣рд┐рдВрджреВрд╕реНрддрд╛рди рд╣реЛ рд░рд╣рд╛ рд╣реИ рдФрд░ рд╣реЛрдирд╛ рднреА рдЪрд╛рд╣рд┐рдП,CAG
facebook_corpus_msr_401246,isse kyo drte ho ..kyoki isse govt. ko profit h,CAG
facebook_corpus_msr_349688,Modh ammar bhai tum khud batao ki muslims ki kyu hota h aatankwadi,CAG
facebook_corpus_msr_493230,Samsung grand max me kyo nahi chal raha h jab ki wo 4 g h ushe apne jio ki list me lao ..,NAG
facebook_corpus_msr_399450,Kaya pagal...Chod...Bat kahi hei iako surgical strick kahate hai...Sale...auqad hei...Surgical strick karne chale...Sale..Pak army ruk do din..Sale..in banchod ko ulta latka kar ghusa deha gand pe..goli,OAG
facebook_corpus_msr_654915,Lekin tumhari trh andhbhkt bhi nhi hu aur apne desh ke pm ka nam modiji likhta hu tumhari trh sirf modi nhi.,CAG
facebook_corpus_msr_1731685,Chara chor ......baklol,OAG
facebook_corpus_msr_300575,Jay bheem,NAG
facebook_corpus_msr_1426990,"рдореБрд░рд╛рджрд╛рдмрд╛рдж рдХреЗ рдХрд╛рдВрда рдореЗрдВ рддрдирд╛рд╡ рдмрд░рдХрд░рд╛рд░, рдкреВрд░реЗ рдЗрд▓рд╛рдХреЗ рдореЗрдВ рдзрд╛рд░рд╛-144 рд▓рд╛рдЧреВ
http://t.co/xj1td5NnRP",NAG
facebook_corpus_msr_443985,"Surya Prakash Goyat рд╣рд┐рдиреНрджреА рдореЗрдВ рдмреЛрд▓рддрд╛ рд╣реВрдВ рдХреНрдпрд╛ рдЗрд╕рд╕реЗ рдкрд╣рд▓реЗ рд╕рд╛рдзрд╛рд░рдг рдЬрдирддрд╛ рдЖрд░рд╛рдо рдореЗрдВ рдереА рдпрд╛ рдлрд┐рд░ рдЗрд╕ рд╕рд░рдХрд╛рд░ рдХреЗ рдЬрд╛рдиреЗ рдХреЗ рдмрд╛рдж рдЖрд░рд╛рдо рдореЗрдВ рд░рд╣реЗрдЧреАред

рдмрддрд╛рдУ рдЕрдЧрд░ рдЖрдкрдХреА рдордирдкрд╕рдВрдж рд╕рд░рдХрд╛рд░ рдЖрдЬ рдлреИрд╕рд▓рд╛ рд▓реЗ  рдХреА рдЪреАрдиреА реи рд░реБрдкрдП рдХрд┐рд▓реЛ рдорд┐рд▓реЗрдЧреА рддреЛ рд╕рд╛рд░реА рдЬрдирддрд╛ рдЦреБрд╢ рд╣реЛрдЧреА (рдЬрдирддрд╛ рдореЗрдВ рд╕рднреА рдЖрддреЗ рд╣реИрдВ ) lala dhukhi hoga

рдХреНрдпрд╛ рдЖрдкрдХреЛ рд╕рд╣реА рдореЗрдВ рдирд╣реАрдВ рдкрддрд╛ рдХреА рдЙрд╕рдХреЗ рдмрд╛рдж рдХрд┐рддрдирд╛ рдХрд╛рд▓рд╛-рдзрди рдкрдХреЬрд╛ рдЧрдпрд╛? рдХрд┐рддрдирд╛ рдирдХрд▓реА рд░реБрдкрдП рдЬрд▓рд╛рдпреЗ рдпрд╛ рдХрд╛рдЯреЗ рдЧрдпреЗ?

рдХрд┐рд╕реА рдкрд╛рд░реНрдЯреА рдХреЛ рд╕рдкреЛрд░реНрдЯ рдХрд░рдирд╛ рдЕрдЫрд┐ рдмрд╛рдд рд╣реИ рдкрд░ рд╕рд╣реА - рдЧрд▓рдд рднреА рддреЛ рдкрддрд╛ рд╣реЛрдирд╛ рдЪрд╛рд╣рд┐рдП.",NAG
facebook_corpus_msr_383001,wo ristedar hai bhai hote to baat hi alag thiЁЯША,CAG
facebook_corpus_msr_383232,Jhat k bal ki bat krte ho hm ne tmri gand far rkhi h tmko pta nhe kia,OAG
facebook_corpus_msr_1731600,Or tum bihar ko lootne mai janta ko ullu bna rhe ho .... chor,OAG
facebook_corpus_msr_1453937,Maine suna hai media bik chuka hai jab dekho aap log hinduo ki burai karte rahte ho our Muslim ki badava dete rahte ho 19agst ko Jhansi mai 100Sal purane shiv Mandir mai puja nahi karne di tab koi media kaha par thi.     kistvad mai hinduo par hamla hua jab media kaha par thi jab ovesi hinduo ke khilaf bol raha to media kaha par thi.  Aap logo ko ek hi chij yad rahti hai godhara kand lekin ye kyo nahi batate ki godhara kand hone ki mukh vajah kya hai,OAG
facebook_corpus_msr_1723864,Bilkul sahi ye katwa log jahan rehta hai wahan hug deta hai sala log desh ka satyanash karke rakha hai in sabko Pakistan maar k bhagao,OAG
facebook_corpus_msr_367886,Sarkar KO maja aatahe desh ke sath khelwar karne me,OAG
facebook_corpus_msr_397612,Aag se khelne ka shok jaldi pura ho Jaye GA tum logon ka agr Russia k tukre kr  sakte hen to India k b kr sakte hen kute ki mot Maren gai tum randians ko Afghanistan me himat to dikhao agr dekhna hai to last atak dekh lo jisme 250 afghani foji mare Gaye,OAG
facebook_corpus_msr_2082564,Sbhi lut the hein bank kuunhi ...jo sarkar satt wali janta ko aram se jeene nhi deti.,OAG
facebook_corpus_msr_1261718,рдФрд░ рдЙрд╕ рд▓рд┐рд╣рд╛рдЬ рд╕реЗ.....рд░рд╛рдзрд╛рдореЛрд╣рди рдмрд╛рдмреВ...........рдХреЛ рднрдЧрд╡рд╛рди рдХрд╛ рдХреМрди рд╕рд╛ рджрд░реНрдЬрд╛ рдкреНрд░рд╛рдкреНрдд рд╣реИ............рдХреГрдкрдпрд╛ рджреЗрд╢ рдХреЛ рдпреЗ рднреА рдмрддрд╛рдпреЗ.........,CAG
facebook_corpus_msr_368245,Vinay Gupta.....tu sona gachi wali aukat may dikha aur so ja warna modi aa jayega.....tere abbu kejriwal ka baap hai.....uski patloon gili ho jati hai modi ke naam seЁЯШЖЁЯШЖЁЯШЖЁЯШУЁЯШУ,OAG
facebook_corpus_msr_372390,рдЗрд╕ рдХреБрддреНрддреЗ рдХреЛ рдХрд╛рдЧреНрд░реЗрдВрд╕ рдХрд┐рдпреВрдВ рдЭреЗрд▓ рд░рд╣реА рд╣реИ.рд╣рд░ рд░реЛрдЬ рдЕрдЬреАрдм рдЕрдЬреАрдм рд╡реНрдпрд╛рди рджреЗрддрд╛ рд░рд╣рддрд╛ рд╣реИ,OAG
facebook_corpus_msr_2032150,Abey paida chutiya hua tha tu yaa fir baad me ho gyaa... Bc kuch b likh rha hai..,OAG
facebook_corpus_msr_373642,рд╕рдИрдж рд╣реИрджрд░ рддреВ рдЕрдкрдиреА рдорд╛ рдХрд╛ рдЪреВрдд рд░реЛрдЬ рджреЗрдЦрддрд╛ рд╣реИ рдХреНрдпрд╛? рднреЛрд╕рдбреАрдХреЗ!,OAG
facebook_corpus_msr_386713,рдХреЙрдВрдЧреНрд░реЗрд╕ рдХрд╛ рд╕реНрдЯреЗрдВрдб рддреЛ рджрд┐рдЧреНрдЧреА рд░рд╛рдЬрд╛ рдордгрд┐рд╢рдВрдХрд░ рдФрд░ рд╕рдВрдЬрдп рдирд┐рд░реВрдкрдо рдиреЗ рдмрддрд╛ рджрд┐рдпрд╛,CAG
facebook_corpus_msr_326795,"Abe land fakir madarchod maine ek baar b mere comment me islam ya muslim nahi likha. Anpad saale padhna aata ho toh padh, land k baal tu is desh k dushman hai jo har baat me dharam ghusa k dange karwata hai madarchod.

Maine jo kuch b likha woh sirf pakistaniyo k liye likha tha bhadwe. Lekin tu lode sympathiser rahega hi unka, teri maa wahi chudi hogi jinnah se pata hai.

Itna hi pyar hai tob Karachi me ghar le k reh le madarchod.

Bhadwe dharam bich me laane ki aadat chod de, tere liye hi accha rahega.

Behanchod ye mulk sabhi religions ka hai lekin tere jaise gaddar ka nahi re madachod, hat tatti ki aulad.",OAG
facebook_corpus_msr_1155459,We strongly condemn the meeting between Asad Owasi and Burhani' father. It will discourage Indian army in their fight against separatism. This meeting between Owaisi and Burhan' father aim nothing but to instigate Indian muslims. #bhaktloli,OAG
facebook_corpus_msr_350007,Pakistan ke agents Hume ek jut ho kr ladna hoga ya hum sab ki zimedari hai srif sarkar ki nahi.,CAG
facebook_corpus_msr_747650,Umeed hai Ab Utter Pardesh ki Janta ne Jo Ummede BJP se Lagaaye hai or UP ki Kamaan Di hai..UP ki Janta ke wo sabhi ummeed BJP dwara poori hogi...,NAG
facebook_corpus_msr_399545,Isay kehty hy ' Ghuss k Marna ' ЁЯШЕЁЯШЕЁЯШЕЁЯШЕ bhenchodo Ab to tmari media be bol rha hy ЁЯШЕЁЯШЕЁЯШЕЁЯШЕЁЯШЕЁЯШЕЁЯШЕ,OAG
facebook_corpus_msr_1423682,"Kya RAHUL ye kahena chahta hai ki amethi me 3 mahine pahele sadak,pani,bizli ki samasya nahi thi....aur ye samasya modi sarkar ane ke baad paida hui hai??.....agar amethi me ye San samsya hai to uske liye waha ke  MP ko bhaga bhaga ke marna  banta hai...Jo seat pe bap Dadao ke jamanse se jame hue hai aur khud hi bowl raha hai ki waha sadak,bijli,pani jaisi basic samasya khatam nahi saka....aur ye chaman waha ki ghadi Obama ko pahenaneke sapne bech raha tha....",OAG
facebook_corpus_msr_351562,Kishan Rajawat Rajput hahahahaha beta khwab me tm log 17 b mar dety ho pakistan me na army ko pata ha na media or india ko pata ha k mar gae hahahahaha tmhri media tm logu ko mamu acha bna leti ha rapistan,CAG
facebook_corpus_msr_1493878,pak govt. manega. tu ja chokobar khane,OAG
facebook_corpus_msr_1376876,15 рдЕрдЧрд╕реНрдд рдХреЛ рд╡рд╛рдШрд╛ рдмреЙрд░реНрдбрд░ рдкрд░ рдкрд╛рдХрд┐рд╕реНрддрд╛рди рдХреЗ рд╕рд╛рде рдорд┐рдард╛рдИ рдирд╣реАрдВ рдмрд╛рдВрдЯреЗрдЧреА рдмреАрдПрд╕рдПрдл,NAG
facebook_corpus_msr_1395920,"BSNL baad me pehle BJP ke chal Charitra aur aacharan pe Dhyan de Kripa hogi, Jai ho Sushma Ji ki",CAG
facebook_corpus_msr_710150,Aaj ak emandar neta ko hara ne ke liye sare beai man ak ho geye,OAG
facebook_corpus_msr_1432158,"рдирд╡рд╛рдЬ рд╢рд░реАрдл, рдирд░реЗрдВрджреНрд░ рдореЛрджреА рдХреЗ рд╢рдкрдердЧреНрд░рд╣рдг рд╕рдорд╛рд░реЛрд╣ рдореЗрдВ рд╢рд╛рдорд┐рд▓ рд╣реЛрдиреЗ рдХреЗ рд▓рд┐рдП рднрд╛рд░рдд рдЖрдПрдВрдЧреЗ",NAG
facebook_corpus_msr_402607,Is suar ko serm nhi aati sala bhart ka khata h or isi ke khilaf bolta h,OAG
facebook_corpus_msr_233903,Netao ke ghar vale ko bhejo tabhi malum padega ki sahadat Kya hoti he,CAG
facebook_corpus_msr_362682,Karo esa hey karo en logo ke sathe kuto ko he dado en logo ko,OAG
facebook_corpus_msr_346663,"рдЕрд▓реНрд▓рд╛рд╣ рддрд╛рд▓реНрд▓рд╛рд╣ рдХреЗ рдлрдЬрд▓ рд╕реЗ
рдкрд╛рдХрд┐рд╕реНрддрд╛рдиреА рдЬреЗрд▓ рдореЗрдВ рд╕рдЬрд╝рд╛ рдХрд╛рдЯ рд░рд╣реЗ
рдЖрддрдВрдХреА рдЬрдХреА-рдЙрд░-рд░рд╣рдорд╛рди-рд▓рдЦрд╡реА
рдХреА рдкрддреНрдиреА рдкреЗрдЯ рд╕реЗ рд╣реИ !ЁЯШЙ

рдЕрд▓реНрд▓рд╛рд╣ рдмрдбрд╛ рд╣рд▓рд╛рд▓реБ рд╣реИ ЁЯШВ",OAG
facebook_corpus_msr_710133,"#рдиреЛрдЯрдмрдВрджреА,,, #рдореАрдЯрдмрдВрджреА рдХреЗ рдмрд╛рдж рдЕрдм рдмрд╛рд░реА рд╣реЗ #рд╕реБрдЕрд░рдмрдВрджреА рдХреА.......",CAG
facebook_corpus_msr_1391629,"рд╣реЗрдорд╛ рдорд╛рд▓рд┐рдиреА рдХреЗ рд▓рд┐рдП рдпреЗ рдбреВрдм рдорд░рдиреЗ рд╡рд╛рд▓реА рдмрд╛рдд рд╣реИ, рд▓реЗрдХрд┐рди рд╡реЛ рдРрд╕рд╛ рдХрд░реЗрдЧреА рдирд╣реАрдВ! рдмреЬреЗ рд╣реИ, рдХреБрдЫ рднреА рдХрд░ рд╕рдХрддреЗ рд╣реИ...!",OAG
facebook_corpus_msr_373331,Feku  nikal delhi me  Akela jaise Canada ka PM nikalta he ya UK ka,OAG
facebook_corpus_msr_395316,Pakistan ko gole barood se nhi direct PARMAANU BOOM SE UDAO na rahe Ga baans na bajegi...........,OAG
